{
  "schemaVersion": 1,
  "asOf": "2026-08-11",
  "status": "inventory_complete_activation_gated",
  "purpose": "Maintain one least-privilege source of truth for every company integration from identification through removal without storing secrets or treating observed human access, conversation, or approval metadata as agent authority.",
  "authority": {
    "accessRequestDeliveryAuthorized": false,
    "accountCreationAuthorized": false,
    "identityInvitationAuthorized": false,
    "credentialCreationAuthorized": false,
    "credentialConnectionAuthorized": false,
    "permissionGrantAuthorized": false,
    "scopeExpansionAuthorized": false,
    "connectorActivationAuthorized": false,
    "schedulerActivationAuthorized": false,
    "externalReadAuthorizedByThisRegister": false,
    "externalWriteAuthorized": false,
    "spendAuthorized": false,
    "conversationIsAuthorization": false,
    "decisionResponseAuthorizesAccess": false
  },
  "rules": {
    "secretValuesPermittedInRepository": false,
    "secretValuesPermittedInChat": false,
    "personalCredentialReusePermitted": false,
    "providerNativeInvitationRequired": true,
    "dedicatedWorkloadIdentityPreferred": true,
    "readBeforeWriteRequired": true,
    "ownerBackupAndRecoveryRequired": true,
    "scopeExpiryAndRevocationRequired": true,
    "writeRequiresSeparateArtifactBoundApproval": true,
    "observedHumanAccessCountsAsConnector": false,
    "successfulReadCountsAsWriteAuthorization": false
  },
  "integrations": [
    {
      "id": "IC-001",
      "system": "Official website public HTTP",
      "domain": "owned_web",
      "stage": "S0",
      "priority": "P0",
      "currentState": "active_anonymous_public_read",
      "providerOrProperty": "https://mythicalvoid.com/",
      "workflowRefs": ["A-001", "A-021", "A-028", "A-033"],
      "dataZones": ["Z0"],
      "minimumRole": "public_anonymous_read",
      "accountableOwner": "Kevin / release owner",
      "ownerConfirmed": false,
      "backupOwner": null,
      "personalDataPossible": false,
      "childDataPossible": false,
      "externalWriteCapable": false,
      "spendCapable": false,
      "observedHumanAccess": false,
      "connectorConfigured": false,
      "credentialRefs": [],
      "requestPrepared": false,
      "approvalRecorded": false,
      "activationReady": false,
      "nextGate": "Keep bounded public reads rate-limited and source-attributed; this access class requires no account and grants no mutation authority.",
      "prohibitedScopes": ["authenticated_session", "site_mutation", "form_submission"]
    },
    {
      "id": "IC-002",
      "system": "GitHub repository and organization",
      "domain": "source_control",
      "stage": "S0",
      "priority": "P0",
      "currentState": "existing_human_access_observed_no_agent_connector",
      "providerOrProperty": "Mythical-Void repository",
      "workflowRefs": ["A-012", "A-018", "A-023", "A-030", "A-031"],
      "dataZones": ["Z0", "Z1", "Z2"],
      "minimumRole": "existing_human_context_read_only_for_company_task",
      "accountableOwner": "Kevin",
      "ownerConfirmed": false,
      "backupOwner": null,
      "personalDataPossible": false,
      "childDataPossible": false,
      "externalWriteCapable": true,
      "spendCapable": false,
      "observedHumanAccess": true,
      "connectorConfigured": false,
      "credentialRefs": [],
      "requestPrepared": false,
      "approvalRecorded": false,
      "activationReady": false,
      "nextGate": "Review organization ownership, recovery, branch protection, audit, mirror, and a dedicated read-only workload identity before any connector; preserve Game Development coordination.",
      "prohibitedScopes": ["repository_write", "workflow_write", "administration", "secret_read", "release_publish"]
    },
    {
      "id": "IC-003",
      "system": "Netlify mythicalvoid project",
      "domain": "hosting_release",
      "stage": "S0",
      "priority": "P0",
      "currentState": "existing_human_access_observed_no_agent_connector",
      "providerOrProperty": "mythicalvoid project",
      "workflowRefs": ["A-001", "A-018", "A-021"],
      "dataZones": ["Z0", "Z1", "Z2"],
      "minimumRole": "existing_human_context_deployment_read_only",
      "accountableOwner": "Kevin / Game Development release owner",
      "ownerConfirmed": false,
      "backupOwner": null,
      "personalDataPossible": true,
      "childDataPossible": true,
      "externalWriteCapable": true,
      "spendCapable": true,
      "observedHumanAccess": true,
      "connectorConfigured": false,
      "credentialRefs": [],
      "requestPrepared": false,
      "approvalRecorded": false,
      "activationReady": false,
      "nextGate": "Name release and rollback owners; review logs, data, spend, recovery, and a separate deployment-read identity. Safeguarding review is required before log or form access.",
      "prohibitedScopes": ["production_deploy", "environment_secret_read", "function_invoke", "billing_change", "form_submission_content"]
    },
    {
      "id": "IC-004",
      "system": "Domain registrar and DNS",
      "domain": "identity_infrastructure",
      "stage": "S2",
      "priority": "P0",
      "currentState": "provider_unknown_no_request",
      "providerOrProperty": null,
      "workflowRefs": ["A-001", "A-009", "A-021", "A-033"],
      "dataZones": ["Z1", "Z3"],
      "minimumRole": "restricted_dns_and_domain_read",
      "accountableOwner": "Kevin",
      "ownerConfirmed": false,
      "backupOwner": null,
      "personalDataPossible": true,
      "childDataPossible": false,
      "externalWriteCapable": true,
      "spendCapable": true,
      "observedHumanAccess": false,
      "connectorConfigured": false,
      "credentialRefs": [],
      "requestPrepared": false,
      "approvalRecorded": false,
      "activationReady": false,
      "nextGate": "Identify registrar/DNS provider, registrant owner, recovery administrator, renewal method, lock, and export route before considering a read-only invitation.",
      "prohibitedScopes": ["dns_write", "domain_transfer", "registrant_change", "renewal_change", "payment_method_access"]
    },
    {
      "id": "IC-005",
      "system": "Search Console or webmaster property",
      "domain": "search_findability",
      "stage": "S2",
      "priority": "P1",
      "currentState": "unknown_no_request",
      "providerOrProperty": null,
      "workflowRefs": ["A-001", "A-021", "A-026"],
      "dataZones": ["Z0", "Z1"],
      "minimumRole": "verified_property_restricted_read",
      "accountableOwner": "Kevin / search owner",
      "ownerConfirmed": false,
      "backupOwner": null,
      "personalDataPossible": false,
      "childDataPossible": false,
      "externalWriteCapable": true,
      "spendCapable": false,
      "observedHumanAccess": false,
      "connectorConfigured": false,
      "credentialRefs": [],
      "requestPrepared": false,
      "approvalRecorded": false,
      "activationReady": false,
      "nextGate": "After coordinated deployment, identify the verified property and owner, then review a read-only identity separately from any sitemap or indexing submission scope.",
      "prohibitedScopes": ["sitemap_submit", "index_request", "property_user_management", "settings_write"]
    },
    {
      "id": "IC-006",
      "system": "Official social and video accounts",
      "domain": "public_channels",
      "stage": "S2",
      "priority": "P1",
      "currentState": "canonical_accounts_unverified_no_request",
      "providerOrProperty": null,
      "workflowRefs": ["A-008", "A-013", "A-020", "A-033", "A-034"],
      "dataZones": ["Z0", "Z1", "Z2"],
      "minimumRole": "channel_identity_and_analytics_read",
      "accountableOwner": "Kevin / channel owner",
      "ownerConfirmed": false,
      "backupOwner": null,
      "personalDataPossible": true,
      "childDataPossible": true,
      "externalWriteCapable": true,
      "spendCapable": true,
      "observedHumanAccess": false,
      "connectorConfigured": false,
      "credentialRefs": [],
      "requestPrepared": false,
      "approvalRecorded": false,
      "activationReady": false,
      "nextGate": "Kevin provides exact URLs or confirms none; verify owner/recovery and complete moderation and safeguarding review before any analytics-read invitation.",
      "prohibitedScopes": ["account_create", "profile_write", "content_publish", "comment_or_message_read", "reply", "moderation_action", "advertising"]
    },
    {
      "id": "IC-007",
      "system": "Business and safeguarding inboxes",
      "domain": "support_safeguarding",
      "stage": "S1",
      "priority": "P0",
      "currentState": "provider_and_ownership_unknown_no_request",
      "providerOrProperty": null,
      "workflowRefs": ["A-004", "A-020", "A-025", "A-039"],
      "dataZones": ["Z2", "Z3"],
      "minimumRole": "restricted_queue_metadata_read_after_routing_test",
      "accountableOwner": "Kevin; safeguarding owner unassigned",
      "ownerConfirmed": false,
      "backupOwner": null,
      "personalDataPossible": true,
      "childDataPossible": true,
      "externalWriteCapable": true,
      "spendCapable": false,
      "observedHumanAccess": false,
      "connectorConfigured": false,
      "credentialRefs": [],
      "requestPrepared": false,
      "approvalRecorded": false,
      "activationReady": false,
      "nextGate": "Provide SGI-001 through SGI-005, resolve D-012/KDP-001, satisfy all A-039 safeguarding coverage, jurisdiction, route, record, evaluation, exercise, kill, and approval gates, then identify provider/admin/recovery before requesting even metadata read.",
      "prohibitedScopes": ["message_body_read", "attachment_read", "direct_minor_contact", "send", "delete", "forward", "unrestricted_content_access"]
    },
    {
      "id": "IC-008",
      "system": "Adult research scheduling, consent, and notes",
      "domain": "customer_research",
      "stage": "S3",